Symbol,Name,Last Sale,Net Change,% Change,Market Cap,Country,IPO Year,Volume,Sector,Industry
CSX,CSX Corporation Common Stock,$33.76,-0.34,-0.997%,74879119955.00,United States,,11093970,Transportation,Railroads
CTAQ,Carney Technology Acquisition Corp. II Class A Common Stock,$9.76,-0.02,-0.204%,499834000.00,United States,2021,11867,,
CTAQU,Carney Technology Acquisition Corp. II Units,$9.92,-0.03,-0.302%,0.00,United States,2020,1900,,
CTAQW,Carney Technology Acquisition Corp. II Warrant,$0.4888,-0.0612,-11.127%,0.00,United States,2021,33720,,
CTAS,Cintas Corporation Common Stock,$375.89,-3.62,-0.954%,38992037993.00,United States,1983,397560,Miscellaneous,Business Services
CTBI,Community Trust Bancorp Inc. Common Stock,$44.56,0.59,1.342%,795087689.00,United States,,22896,Finance,Major Banks
CTG,Computer Task Group Inc. Common Stock,$8.19,-0.28,-3.306%,125656893.00,United States,,9015,Technology,EDP Services
CTHR,Charles & Colvard Ltd Common Stock,$2.2362,-0.1938,-7.975%,68013916.00,United States,1997,107607,Consumer Non-Durables,Consumer Specialties
CTIB,Yunhong CTI Ltd. Common Stock,$0.90,-0.0908,-9.164%,5298075.00,United States,1997,59337,Miscellaneous,Diversified Commercial Services
CTIC,CTI BioPharma Corp. (DE) Common Stock,$2.094,-0.116,-5.249%,202473936.00,United States,1997,1228133,Health Care,Biotechnology: Pharmaceutical Preparations
CTKB,Cytek Biosciences Inc. Common Stock,$14.44,0.22,1.547%,1931002112.00,United States,2021,149728,Health Care,Biotechnology: Electromedical & Electrotherapeutic Apparatus
CTLP,Cantaloupe Inc. Common Stock,$7.50,-0.19,-2.471%,532261230.00,United States,,98525,Technology,EDP Services
CTMX,CytomX Therapeutics Inc. Common Stock,$4.17,-0.12,-2.797%,272088814.00,United States,2015,517227,Health Care,Biotechnology: Pharmaceutical Preparations
CTRE,CareTrust REIT Inc. Common Stock,$20.63,-0.72,-3.372%,2001787613.00,United States,,383164,Consumer Services,Real Estate Investment Trusts
CTRM,Castor Maritime Inc. Common Shares,$1.025,-0.105,-9.292%,96975340.00,Cyprus,,2567274,Transportation,Marine Transportation
CTRN,Citi Trends Inc. Common Stock,$51.865,1.295,2.561%,440599866.00,United States,2005,219934,,
CTSH,Cognizant Technology Solutions Corporation Class A Common Stock,$82.51,-1.75,-2.077%,43338520572.00,United States,1998,1824310,Technology,EDP Services
CTSO,Cytosorbents Corporation Common Stock,$3.3817,-0.0183,-0.538%,147021599.00,United States,,147241,Health Care,Medical/Dental Instruments
CTXR,Citius Pharmaceuticals Inc. Common Stock,$1.35,-0.12,-8.163%,197140001.00,United States,,2862673,Health Care,Biotechnology: Pharmaceutical Preparations
CTXRW,Citius Pharmaceuticals Inc. Warrant,$0.4537,-0.1463,-24.383%,0.00,United States,,3950,Health Care,Biotechnology: Pharmaceutical Preparations
CTXS,Citrix Systems Inc. Common Stock,$101.14,0.02,0.02%,12614471274.00,United States,1995,739653,Technology,Computer Software: Prepackaged Software
CUBA,Herzfeld Caribbean Basin Fund Inc. (The) Common Stock,$5.17,-0.33,-6.00%,30125497.00,United States,,37087,Finance,Investment Managers
CUE,Cue Biopharma Inc. Common Stock,$8.66,-0.34,-3.778%,275049792.00,United States,2018,344507,Health Care,Biotechnology: Pharmaceutical Preparations
CUEN,Cuentas Inc. Common Stock,$0.9649,-0.1351,-12.282%,14440394.00,United States,,66022,Technology,Computer Software: Prepackaged Software
CUENW,Cuentas Inc. Warrant,$0.241,-0.049,-16.897%,0.00,United States,,4408,Technology,Computer Software: Prepackaged Software
CULL,Cullman Bancorp Inc. Common Stock,$12.60,0.00,0.00%,93314252.00,United States,2021,162,Finance,Savings Institutions
CURI,CuriosityStream Inc. Class A Common Stock,$3.93,-0.17,-4.146%,206797885.00,United States,2020,584721,Consumer Services,Broadcasting
CURIW,CuriosityStream Inc. Warrant,$0.5347,-0.1153,-17.738%,0.00,United States,2020,14966,Consumer Services,Broadcasting
CUTR,Cutera Inc. Common Stock,$33.3737,0.0537,0.161%,599281819.00,United States,2004,105441,Health Care,Biotechnology: Electromedical & Electrotherapeutic Apparatus
CVAC,CureVac N.V. Ordinary Shares,$17.35,-1.38,-7.368%,3243624244.00,Germany,2020,771975,Health Care,Biotechnology: Pharmaceutical Preparations
CVBF,CVB Financial Corporation Common Stock,$22.34,0.05,0.224%,3219675092.00,United States,,263683,Finance,Major Banks
CVCO,Cavco Industries Inc. Common Stock When Issued,$257.62,4.02,1.585%,2364259890.00,United States,,29290,Basic Industries,Homebuilding
CVCY,Central Valley Community Bancorp Common Stock,$22.21,-0.38,-1.682%,266253569.00,United States,,18487,Finance,Major Banks
CVET,Covetrus Inc. Common Stock,$17.12,-0.20,-1.155%,2358851055.00,United States,,641216,Health Care,Managed Health Care
CVGI,Commercial Vehicle Group Inc. Common Stock,$7.72,-0.13,-1.656%,254593626.00,United States,2004,133362,Capital Goods,Auto Parts:O.E.M.
CVGW,Calavo Growers Inc. Common Stock,$41.92,0.65,1.575%,741060293.00,United States,,30881,,Farming/Seeds/Milling
CVLG,Covenant Logistics Group Inc. Class A Common Stock,$22.37,0.31,1.405%,373971437.00,United States,,29736,Transportation,Trucking Freight/Courier Services
CVLT,Commvault Systems Inc. Common Stock,$65.495,-0.865,-1.303%,2980590669.00,United States,2006,299472,Technology,Computer Software: Prepackaged Software
CVLY,Codorus Valley Bancorp Inc Common Stock,$21.45,-0.28,-1.289%,204517299.00,United States,,7259,Finance,Savings Institutions
CVRX,CVRx Inc. Common Stock,$8.263,-0.607,-6.843%,168166750.00,United States,2021,34145,Health Care,Biotechnology: Electromedical & Electrotherapeutic Apparatus
CVT,Cvent Holding Corp. Common Stock,$6.67,0.00,0.00%,3209081706.00,United States,1987,60217,Technology,Computer Software: Prepackaged Software
CVV,CVD Equipment Corporation Common Stock,$4.51,-0.14,-3.011%,30160345.00,United States,,16891,Technology,Industrial Machinery/Components
CWBC,Community West Bancshares Common Stock,$13.48,0.08,0.597%,116146187.00,United States,,2032,Finance,Major Banks
CWBR,CohBar Inc. Common Stock,$0.2639,-0.0495,-15.795%,22710263.00,United States,,821851,Health Care,Biotechnology: In Vitro & In Vivo Diagnostic Substances
CWCO,Consolidated Water Co. Ltd. Ordinary Shares,$9.84,-0.10,-1.006%,149673278.00,Cayman Islands,,50524,Public Utilities,Water Supply
CWST,Casella Waste Systems Inc. Class A Common Stock,$74.14,-0.75,-1.001%,3810645718.00,United States,1997,133553,Public Utilities,Environmental Services
CXDO,Crexendo Inc. Common Stock,$3.835,-0.315,-7.59%,83162796.00,United States,,28062,Consumer Services,Telecommunications Equipment
CYAD,Celyad Oncology SA American Depositary Shares,$3.5496,-0.3904,-9.909%,80199506.00,Belgium,2015,19315,Health Care,Biotechnology: Pharmaceutical Preparations
CYAN,Cyanotech Corporation Common Stock,$2.78,-0.06,-2.113%,17219781.00,United States,,21793,Consumer Non-Durables,Farming/Seeds/Milling
CYBE,CyberOptics Corporation Common Stock,$35.25,-0.95,-2.624%,259283102.00,United States,1987,43635,Capital Goods,Electronic Components
CYBR,CyberArk Software Ltd. Ordinary Shares,$131.78,-5.12,-3.74%,5239528258.00,Israel,2014,214866,Technology,Computer Software: Prepackaged Software
CYCC,Cyclacel Pharmaceuticals Inc. Common Stock,$2.85,-0.28,-8.946%,28429135.00,United States,,112975,Health Care,Biotechnology: Pharmaceutical Preparations
CYCCP,Cyclacel Pharmaceuticals Inc. 6% Convertible Preferred Stock,$7.5581,-0.0419,-0.551%,0.00,United States,,222,Health Care,Biotechnology: Pharmaceutical Preparations
CYCN,Cyclerion Therapeutics Inc. Common Stock,$1.18,-0.07,-5.60%,51112579.00,United States,,122877,Health Care,Biotechnology: Pharmaceutical Preparations
CYN,Cyngn Inc. Common Stock,$2.395,-0.545,-18.537%,63310113.00,United States,2021,208245,Technology,EDP Services
CYRN,CYREN Ltd. Ordinary Shares,$0.2138,-0.019,-8.162%,19382860.00,United States,,1476672,Technology,Computer Software: Prepackaged Software
CYRX,CryoPort Inc. Common Stock,$41.09,-0.68,-1.628%,2028518629.00,United States,,339018,,
CYT,Cyteir Therapeutics Inc. Common Stock,$5.61,0.08,1.447%,198430912.00,United States,2021,62001,Health Care,Biotechnology: Pharmaceutical Preparations
CYTH,Cyclo Therapeutics Inc. Common Stock,$3.47,-0.35,-9.162%,29166131.00,United States,,68976,Health Care,Biotechnology: Pharmaceutical Preparations
CYTHW,Cyclo Therapeutics Inc. Warrant,$1.86,0.00,0.00%,0.00,United States,,10,Health Care,Biotechnology: Pharmaceutical Preparations
CYTK,Cytokinetics Incorporated Common Stock,$30.315,0.015,0.05%,2558408203.00,United States,2004,351166,Health Care,Biotechnology: Pharmaceutical Preparations
CYTO,Altamira Therapeutics Ltd. Common Shares 0.01 SF (Bermuda),$1.22,-0.12,-8.955%,18092064.00,Bermuda,2014,240080,Health Care,Biotechnology: Pharmaceutical Preparations
CYXT,Cyxtera Technologies Inc. Class A Common Stock,$10.84,-0.02,-0.184%,1823847604.00,United States,2020,166085,Technology,EDP Services
CZNC,Citizens & Northern Corp Common Stock,$25.3688,0.2088,0.83%,399584096.00,United States,,11954,Finance,Major Banks
CZR,Caesars Entertainment Inc. Common Stock,$69.04,-3.13,-4.337%,14758960550.00,United States,,3089466,Consumer Services,Hotels/Resorts
CZWI,Citizens Community Bancorp Inc. Common Stock,$13.90,-0.09,-0.643%,145983944.00,United States,,5782,Finance,Savings Institutions
DADA,Dada Nexus Limited American Depositary Shares,$10.50,-0.76,-6.75%,2456287124.00,China,2020,894040,Consumer Services,Department/Specialty Retail Stores
DAIO,Data I/O Corporation Common Stock,$4.5077,-0.1323,-2.851%,38860913.00,United States,1981,26929,Capital Goods,Industrial Machinery/Components
DAKT,Daktronics Inc. Common Stock,$4.645,-0.155,-3.229%,211184725.00,United States,1994,254452,Capital Goods,Office Equipment/Supplies/Services
DALN,DallasNews Corporation Series A Common Stock,$6.871,-0.179,-2.539%,36776959.00,United States,,15601,Consumer Services,Newspapers/Magazines
DALS,DA32 Life Science Tech Acquisition Corp. Class A Common Stock,$9.74,0.00,0.00%,249831000.00,United States,2021,10,,
DAOO,Crypto 1 Acquisition Corp Class A Ordinary Shares,$9.79,-0.01,-0.102%,281462500.00,United States,2022,65280,,
DAOOU,Crypto 1 Acquisition Corp Unit,$10.02,-0.10,-0.988%,0.00,United States,2021,88239,,
DAOOW,Crypto 1 Acquisition Corp Warrants,$0.42,0.00,0.00%,0.00,United States,2022,89307,,
DARE,Dare Bioscience Inc. Common Stock,$1.375,-0.145,-9.539%,105327233.00,United States,2014,2360793,Health Care,Biotechnology: Pharmaceutical Preparations
DATS,DatChat Inc. Common Stock,$2.39,-0.23,-8.779%,46837831.00,United States,2021,2003140,Technology,Computer Software: Prepackaged Software
DATSW,DatChat Inc. Series A Warrant,$1.35,0.08,6.299%,0.00,United States,2021,766,Technology,Computer Software: Prepackaged Software
DAVE,Dave Inc. Class A Common Stock,$8.95,-0.48,-5.09%,3329406551.00,United States,,3281325,Technology,Retail: Computer Software & Peripheral Equipment
DAVEW,Dave Inc. Warrants,$0.81,0.0599,7.986%,0.00,United States,,350973,Technology,Retail: Computer Software & Peripheral Equipment
DAWN,Day One Biopharmaceuticals Inc. Common Stock,$14.11,-0.52,-3.554%,873817329.00,United States,2021,100274,Health Care,Biotechnology: Pharmaceutical Preparations
DBGI,Digital Brands Group Inc. Common Stock,$1.12,-0.04,-3.448%,14334933.00,United States,2021,335140,Consumer Non-Durables,Apparel
DBGIW,Digital Brands Group Inc. Warrant,$0.3499,-0.0899,-20.441%,0.00,United States,2021,4413,Consumer Non-Durables,Apparel
DBTX,Decibel Therapeutics Inc. Common Stock,$4.40,-0.19,-4.139%,109662797.00,United States,2021,107055,Health Care,Biotechnology: Pharmaceutical Preparations
DBVT,DBV Technologies S.A. American Depositary Shares,$1.395,-0.175,-11.146%,153288545.00,France,2014,195777,Health Care,Biotechnology: Biological Products (No Diagnostic Substances)
DBX,Dropbox Inc. Class A Common Stock,$22.891,-0.619,-2.633%,8755121136.00,United States,2018,2920153,Technology,Computer Software: Prepackaged Software
DCBO,Docebo Inc. Common Shares,$51.27,-1.18,-2.25%,1684562035.00,Canada,,113633,,
DCFC,Tritium DCFC Limited Ordinary Shares,$7.07,-0.18,-2.483%,1082413112.00,Australia,,98668,Technology,Electronic Components
DCFCW,Tritium DCFC Limited Warrant,$1.19,-0.12,-9.16%,0.00,Australia,,212183,Technology,Electronic Components
DCGO,DocGo Inc. Common Stock,$6.2998,-0.1002,-1.566%,630417446.00,United States,2020,303262,Health Care,Managed Health Care
DCGOW,DocGo Inc. Warrants,$1.25,-0.15,-10.714%,0.00,United States,2020,36125,Health Care,Managed Health Care
DCOM,Dime Community Bancshares Inc. Common Stock,$36.05,-0.07,-0.194%,1458382490.00,United States,,43255,Finance,Savings Institutions
DCOMP,Dime Community Bancshares Inc. Fixed-Rate Non-Cumulative Perpetual Preferred Stock Series A,$24.96,-0.16,-0.637%,0.00,United States,,19412,Finance,Savings Institutions
DCPH,Deciphera Pharmaceuticals Inc. Common Stock,$8.00,-0.04,-0.498%,467846696.00,United States,2017,506487,Health Care,Biotechnology: Pharmaceutical Preparations
DCRD,Decarbonization Plus Acquisition Corporation IV Class A Ordinary Share,$9.86,0.01,0.102%,389778125.00,United States,2021,20208,,
DCRDW,Decarbonization Plus Acquisition Corporation IV Warrant,$0.8305,-0.0311,-3.61%,0.00,United States,2021,59462,,
DCT,Duck Creek Technologies Inc. Common Stock,$23.05,-1.09,-4.515%,3044829972.00,United States,2020,547907,Technology,Retail: Computer Software & Peripheral Equipment
DCTH,Delcath Systems Inc. Common Stock,$6.46,-0.24,-3.582%,47521627.00,United States,,13721,Health Care,Medical Specialities
DDI,DoubleDown Interactive Co. Ltd. American Depository Shares,$12.14,-0.41,-3.267%,601578762.00,South Korea,2021,19372,Technology,EDP Services
DDOG,Datadog Inc. Class A Common Stock,$126.00,0.45,0.358%,39314062368.00,United States,2019,3250450,Technology,EDP Services
DENN,Denny's Corporation Common Stock,$14.45,-0.19,-1.298%,915928581.00,United States,,245598,Consumer Services,Restaurants
DERM,Journey Medical Corporation Common Stock,$5.10,0.08,1.594%,84964195.00,United States,2021,25577,Health Care,Biotechnology: Pharmaceutical Preparations
DFFN,Diffusion Pharmaceuticals Inc. Common Stock,$0.2315,-0.0214,-8.462%,23594556.00,United States,,965495,Health Care,Biotechnology: Pharmaceutical Preparations
DFH,Dream Finders Homes Inc. Class A Common Stock,$17.565,-0.035,-0.199%,1625139831.00,United States,2021,111835,,
DGHI,Digihost Technology Inc. Common Subordinate Voting Shares,$2.74,-0.34,-11.039%,68581131.00,Canada,,311929,,
DGICA,Donegal Group Inc. Class A Common Stock,$14.305,-0.045,-0.314%,448166309.00,United States,,13502,Finance,Property-Casualty Insurers
DGICB,Donegal Group Inc. Class B Common Stock,$13.2831,-0.6769,-4.849%,416150849.00,United States,1986,754,Finance,Property-Casualty Insurers
DGII,Digi International Inc. Common Stock,$21.69,-0.45,-2.033%,752735183.00,United States,1989,71089,Technology,Computer peripheral equipment
DGLY,Digital Ally Inc. Common Stock,$0.96,-0.07,-6.796%,50594829.00,United States,,763264,Miscellaneous,Diversified Manufacture
DGNU,Dragoneer Growth Opportunities Corp. III Class A Ordinary Shares,$9.715,0.005,0.051%,523002245.00,United States,2021,107960,Finance,Business Services
DH,Definitive Healthcare Corp. Class A Common Stock,$18.65,-0.18,-0.956%,1851261160.00,United States,2021,713383,Technology,Computer Software: Prepackaged Software
DHAC,Digital Health Acquisition Corp. Common Stock,$9.91,-0.01,-0.101%,147976120.00,United States,2021,91930,,
DHACU,Digital Health Acquisition Corp. Unit,$10.18,0.00,0.00%,0.00,United States,2021,800,,
DHACW,Digital Health Acquisition Corp. Warrant,$0.29,0.00,0.00%,0.00,United States,2021,100,,
DHBC,DHB Capital Corp. Class A common stock,$9.69,-0.03,-0.309%,348234375.00,United States,2021,246039,,
DHBCU,DHB Capital Corp. Unit,$9.88,0.00,0.00%,355062500.00,United States,2021,11,,
DHBCW,DHB Capital Corp. Warrant,$0.49,-0.0062,-1.249%,0.00,United States,2021,73901,,
DHC,Diversified Healthcare Trust Common Shares of Beneficial Interest,$2.91,-0.10,-3.322%,695475142.00,United States,,761255,Consumer Services,Real Estate Investment Trusts
DHCA,DHC Acquisition Corp. Class A ordinary share,$9.72,0.00,0.00%,375982625.00,United States,2021,54,Finance,Business Services
DHCAU,DHC Acquisition Corp. Unit,$9.85,-0.035,-0.354%,0.00,United States,2021,200,Finance,Business Services
DHCAW,DHC Acquisition Corp. Warrant,$0.4671,-0.0029,-0.617%,0.00,United States,2021,13057,Finance,Business Services
DHCNI,Diversified Healthcare Trust 5.625% Senior Notes due 2042,$21.1253,-0.4047,-1.88%,0.00,United States,,12347,Consumer Services,Real Estate Investment Trusts
DHCNL,Diversified Healthcare Trust 6.25% Senior Notes Due 2046,$22.33,-0.28,-1.238%,0.00,United States,,25668,Consumer Services,Real Estate Investment Trusts
DHHC,DiamondHead Holdings Corp. Class A Common Stock,$9.725,-0.015,-0.154%,419390625.00,United States,2021,46229,,
DHHCU,DiamondHead Holdings Corp. Unit,$9.83,-0.02,-0.203%,0.00,United States,2021,248195,,
DHHCW,DiamondHead Holdings Corp. Warrant,$0.5099,0.0099,1.98%,0.00,United States,2021,82004,,
DHIL,Diamond Hill Investment Group Inc. Class A Common Stock,$177.83,-0.49,-0.275%,564022522.00,United States,,5067,Finance,Investment Managers
DIBS,1stdibs.com Inc. Common Stock,$9.13,-0.25,-2.665%,345806054.00,United States,2021,150231,Miscellaneous,Diversified Commercial Services
DICE,DICE Therapeutics Inc. Common Stock,$14.20,-0.34,-2.338%,542886093.00,United States,2021,207144,Health Care,Biotechnology: Pharmaceutical Preparations
DILA,DILA Capital Acquisition Corp. Class A Common Stock,$9.741,0.00,0.00%,73831666.00,Mexico,2021,17,,
DILAW,DILA Capital Acquisition Corp. Warrant,$0.4301,-0.2598,-37.658%,0.00,Mexico,2021,3396,,
DIOD,Diodes Incorporated Common Stock,$84.83,-1.44,-1.669%,3818857005.00,United States,,128002,Technology,Semiconductors
DISA,Disruptive Acquisition Corporation I Class A Ordinary Shares,$9.68,-0.06,-0.616%,332750000.00,United States,2021,4362,Finance,Business Services
DISAU,Disruptive Acquisition Corporation I Unit,$9.83,-0.08,-0.807%,0.00,United States,2021,1000,Finance,Business Services
DISAW,Disruptive Acquisition Corporation I Warrant,$0.60,0.00,0.00%,0.00,United States,2021,12203,Finance,Business Services
DISCA,Discovery Inc. Series A Common Stock,$25.525,-0.665,-2.539%,12914216286.00,United States,,4497009,Consumer Services,Television Services
DISCB,Discovery Inc. Series B Common Stock,$31.3713,-2.0287,-6.074%,15872115705.00,United States,,4536,Consumer Services,Television Services
DISCK,Discovery Inc. Series C Common Stock,$24.87,-0.66,-2.585%,12580884684.00,United States,,3047125,Consumer Services,Television Services
DISH,DISH Network Corporation Class A Common Stock,$29.37,-2.39,-7.525%,15530903433.00,United States,1995,3606172,Consumer Services,Television Services
DJCO,Daily Journal Corp. (S.C.) Common Stock,$326.71,-9.30,-2.768%,451103526.00,United States,,1640,Consumer Services,Newspapers/Magazines
DKDCA,Data Knights Acquisition Corp. Class A Common Stock,$10.10,0.00,0.00%,151098778.00,United Kingdom,2021,2001,,
DKDCW,Data Knights Acquisition Corp. Warrant,$0.31,0.00,0.00%,0.00,United Kingdom,2021,11800,,
DKNG,DraftKings Inc. Class A Common Stock,$18.27,-1.19,-6.115%,7427241146.00,United States,2019,22724367,Consumer Services,Services-Misc. Amusement & Recreation
DLCA,Deep Lake Capital Acquisition Corp. Class A Ordinary Shares,$9.71,-0.02,-0.206%,251246250.00,United States,2021,103408,Finance,Business Services
DLCAU,Deep Lake Capital Acquisition Corp. Unit,$9.94,-0.04,-0.401%,0.00,United States,2021,4512,Finance,Business Services
DLCAW,Deep Lake Capital Acquisition Corp. Warrant,$0.40,-0.06,-13.043%,0.00,United States,2021,24416,Finance,Business Services
DLHC,DLH Holdings Corp.,$16.56,-0.84,-4.828%,210548295.00,United States,,74881,Miscellaneous,Business Services
DLO,DLocal Limited Class A Common Shares,$24.28,-1.15,-4.522%,7163290547.00,Uruguay,2021,1222833,,
DLPN,Dolphin Entertainment Inc. Common Stock,$5.34,-0.74,-12.171%,42682946.00,United States,,52784,,
DLTH,Duluth Holdings Inc. Class B Common Stock,$13.98,0.12,0.866%,462214002.00,United States,2015,89217,Consumer Services,Department/Specialty Retail Stores
DLTR,Dollar Tree Inc. Common Stock,$128.89,2.66,2.107%,28994586445.00,United States,1995,905899,Consumer Services,Department/Specialty Retail Stores
DMAC,DiaMedica Therapeutics Inc. Common Stock,$2.23,-0.42,-15.849%,58959454.00,United States,2018,334148,,
DMAQ,Deep Medicine Acquisition Corp. Class A Common Stock,$9.85,-0.03,-0.304%,161867020.00,United States,2021,44650,,
DMAQR,Deep Medicine Acquisition Corp. Rights,$0.28,0.00,0.00%,0.00,United States,2021,5300,,
DMLP,Dorchester Minerals L.P. Common Units Representing Limited Partnership Interests,$21.57,-0.57,-2.575%,797761575.00,United States,,56831,Energy,Oil & Gas Production
DMRC,Digimarc Corporation Common Stock,$31.55,-0.90,-2.773%,558802431.00,United States,,96810,Technology,EDP Services
DMTK,DermTech Inc. Common Stock,$11.52,-0.56,-4.636%,342342121.00,United States,2017,773535,Health Care,Managed Health Care
DNAA,Social Capital Suvretta Holdings Corp. I Class A Ordinary Share,$9.66,-0.01,-0.103%,308057400.00,United States,2021,95546,,
DNAB,Social Capital Suvretta Holdings Corp. II Class A Ordinary Shares,$9.63,-0.02,-0.207%,307100700.00,United States,2021,861395,,
DNAC,Social Capital Suvretta Holdings Corp. III Class A ordinary shares,$9.78,-0.05,-0.509%,311884200.00,United States,2021,181894,,
DNAD,Social Capital Suvretta Holdings Corp. IV Class A Ordinary Shares,$9.64,-0.04,-0.413%,307419600.00,United States,2021,61660,Health Care,Biotechnology: Pharmaceutical Preparations
DNAY,Codex DNA Inc. Common Stock,$6.95,-0.31,-4.27%,203685033.00,United States,2021,235556,Health Care,Medical Specialities
DNLI,Denali Therapeutics Inc. Common Stock,$32.245,-0.115,-0.355%,3937939359.00,United States,2017,358949,Health Care,Biotechnology: Biological Products (No Diagnostic Substances)
DNUT,Krispy Kreme Inc. Common Stock,$14.27,-0.10,-0.696%,2386667988.00,United States,2021,598108,Consumer Services,Specialty Foods
DOCU,DocuSign Inc. Common Stock,$112.80,-3.33,-2.867%,22320471794.00,United States,2018,4173762,Technology,EDP Services
DOGZ,Dogness (International) Corporation Class A Common Stock,$3.3301,-0.4799,-12.596%,105906951.00,China,2017,706601,Consumer Durables,Miscellaneous manufacturing industries
DOMO,Domo Inc. Class B Common Stock,$39.56,-1.31,-3.205%,1290057574.00,United States,2018,409556,Technology,Computer Software: Prepackaged Software
DOOO,BRP Inc. (Recreational Products) Common Subordinate Voting Shares,$75.72,-0.36,-0.473%,6209389448.00,Canada,,87960,,
DORM,Dorman Products Inc. Common Stock,$94.57,0.86,0.918%,2990658510.00,United States,,196205,Capital Goods,Auto Parts:O.E.M.
DOX,Amdocs Limited Ordinary Shares,$73.23,-1.85,-2.464%,9126055000.00,Guernsey,,218856,Technology,EDP Services
DOYU,DouYu International Holdings Limited ADS,$2.195,-0.125,-5.388%,712079489.00,China,2019,2235983,Technology,Computer Software: Programming Data Processing
DPCS,DP Cap Acquisition Corp I Class A Ordinary Shares,$9.91,0.00,0.00%,284912500.00,United States,2021,1,,
DPCSU,DP Cap Acquisition Corp I Unit,$10.095,-0.005,-0.05%,0.00,United States,2021,250,,
DPCSW,DP Cap Acquisition Corp I Warrants,$0.475,-0.015,-3.061%,0.00,United States,2021,4082,,
DPRO,Draganfly Inc. Common Shares,$1.065,-0.125,-10.504%,34247152.00,Canada,,242647,Consumer Durables,Electronic Components
DRAY,Macondray Capital Acquisition Corp. I Class A Ordinary Shares,$9.79,-0.02,-0.204%,351828125.00,United States,2021,11907,,
DRAYU,Macondray Capital Acquisition Corp. I Unit,$9.95,0.005,0.05%,0.00,United States,2021,10029,,
DRAYW,Macondray Capital Acquisition Corp. I Warrant,$0.4594,-0.0106,-2.255%,0.00,United States,2021,98703,,
DRIO,DarioHealth Corp. Common Stock,$8.10,-0.06,-0.735%,134262627.00,Israel,,200428,Health Care,Medical/Dental Instruments
DRMA,Dermata Therapeutics Inc. Common Stock,$1.4364,-0.2036,-12.415%,11963243.00,United States,2021,142923,Health Care,Biotechnology: Pharmaceutical Preparations
DRMAW,Dermata Therapeutics Inc. Warrant,$0.3464,-0.024,-6.479%,0.00,United States,2021,1650,Health Care,Biotechnology: Pharmaceutical Preparations
DRRX,DURECT Corporation Common Stock,$0.627,-0.0329,-4.986%,142646143.00,United States,2000,346140,Health Care,Biotechnology: Pharmaceutical Preparations
DRTT,DIRTT Environmental Solutions Ltd. Common Shares,$1.81,-0.01,-0.549%,154455545.00,Canada,,32343,,
DRUG,Bright Minds Biosciences Inc. Common Stock,$2.125,-0.505,-19.202%,25174580.00,Canada,,29606,,
DRVN,Driven Brands Holdings Inc. Common Stock,$27.98,-1.25,-4.276%,4683286384.00,United States,2021,616087,,
DSAC,Duddell Street Acquisition Corp. Class A Ordinary Shares,$9.895,-0.005,-0.051%,216453125.00,Hong Kong,2020,34499,Finance,Business Services
DSACU,Duddell Street Acquisition Corp. Unit,$10.26,-0.11,-1.061%,0.00,Hong Kong,2020,505,Finance,Business Services
DSACW,Duddell Street Acquisition Corp. Warrant,$0.79,-0.0001,-0.013%,0.00,Hong Kong,2020,2500,Finance,Business Services
DSEY,Diversey Holdings Ltd. Ordinary Shares,$10.26,-0.51,-4.735%,3256843496.00,United States,2021,367928,Consumer Durables,Specialty Chemicals
DSGN,Design Therapeutics Inc. Common Stock,$11.00,-0.17,-1.522%,612287511.00,United States,2021,49548,Health Care,Biotechnology: Pharmaceutical Preparations
DSGX,Descartes Systems Group Inc. (The) Common Stock,$66.02,-2.00,-2.94%,5589094950.00,Canada,,144801,,
DSKE,Daseke Inc. Common Stock,$8.87,-0.29,-3.166%,554279852.00,United States,2015,143614,,
DSKEW,Daseke Inc. Warrant,$0.03,0.0039,14.943%,0.00,United States,2015,38242,,
DSP,Viant Technology Inc. Class A Common Stock,$6.63,-0.33,-4.741%,89389307.00,United States,2021,148597,Technology,EDP Services
DSWL,Deswell Industries Inc. Common Shares,$3.90,0.00,0.00%,62147432.00,Macau,1995,6452,Consumer Non-Durables,Plastic Products
