Symbol,Name,Last Sale,Net Change,% Change,Market Cap,Country,IPO Year,Volume,Sector,Industry
INSG,Inseego Corp. Common Stock,$4.115,-0.225,-5.184%,432595074.00,United States,,1153423,Capital Goods,Telecommunications Equipment
INSM,Insmed Inc. Common Stock,$21.47,-0.53,-2.409%,2541449696.00,United States,,588695,Health Care,Biotechnology: Pharmaceutical Preparations
INTA,Intapp Inc. Common Stock,$17.87,-0.82,-4.387%,1089875557.00,United States,2021,67698,Technology,Computer Software: Prepackaged Software
INTC,Intel Corporation Common Stock,$50.329,-1.711,-3.288%,204688043000.00,United States,,28420269,Technology,Semiconductors
INTE,Integral Acquisition Corporation 1 Class A Common Stock,$9.92,0.06,0.609%,114080000.00,United States,2021,473,,
INTEU,Integral Acquisition Corporation 1 Unit,$10.0341,0.0341,0.341%,0.00,United States,2021,100,,
INTEW,Integral Acquisition Corporation 1 Warrants,$0.4556,0.0026,0.574%,0.00,United States,2021,5899,,
INTG,Intergroup Corporation (The) Common Stock,$49.55,-1.15,-2.268%,108969964.00,United States,,917,Consumer Services,Hotels/Resorts
INTU,Intuit Inc. Common Stock,$510.95,-17.60,-3.33%,144684127555.00,United States,1993,1316469,Technology,Computer Software: Prepackaged Software
INTZ,Intrusion Inc. Common Stock,$3.45,-0.40,-10.39%,64836009.00,United States,,58986,Miscellaneous,Diversified Manufacture
INVA,Innoviva Inc. Common Stock,$15.89,-0.28,-1.732%,1104231074.00,United States,,190096,Health Care,Biotechnology: Pharmaceutical Preparations
INVE,Identiv Inc. Common Stock,$17.585,-0.895,-4.843%,390507264.00,United States,,123544,Technology,Computer peripheral equipment
INVO,INVO BioScience Inc. Common Stock,$2.92,-0.08,-2.667%,34265534.00,United States,,55361,Health Care,Medical/Dental Instruments
INVZ,Innoviz Technologies Ltd. Ordinary shares,$3.39,-0.09,-2.586%,453224013.00,Israel,,1381547,Capital Goods,Auto Parts:O.E.M.
INVZW,Innoviz Technologies Ltd. Warrant,$0.9501,-0.1849,-16.291%,0.00,Israel,,12117,Capital Goods,Auto Parts:O.E.M.
INZY,Inozyme Pharma Inc. Common Stock,$6.58,-0.22,-3.235%,155714035.00,United States,2020,43452,Health Care,Biotechnology: Pharmaceutical Preparations
IOAC,Innovative International Acquisition Corp. Class A Ordinary Shares,$9.94,0.00,0.00%,319173400.00,United States,2022,1,,
IOACU,Innovative International Acquisition Corp. Unit,$10.07,0.00,0.00%,0.00,United States,2021,5,,
IOACW,Innovative International Acquisition Corp. Warrants,$0.3675,-0.0018,-0.487%,0.00,United States,2022,6525,,
IOBT,IO Biotech Inc. Common Stock,$5.8247,-0.5803,-9.06%,167840286.00,Denmark,2021,9862,Health Care,Biotechnology: Pharmaceutical Preparations
IONM,Assure Holdings Corp. Common Stock,$4.75,0.00,0.00%,60889614.00,United States,,133,Health Care,Assisted Living Services
IONS,Ionis Pharmaceuticals Inc. Common Stock,$29.60,-0.28,-0.937%,4179816444.00,United States,,731298,Health Care,Biotechnology: Pharmaceutical Preparations
IOSP,Innospec Inc. Common Stock,$92.8375,-1.5525,-1.645%,2288206061.00,United States,,38037,Basic Industries,Industrial Specialties
IOVA,Iovance Biotherapeutics Inc. Common Stock,$13.64,-0.32,-2.292%,2140103970.00,United States,,1452568,Health Care,Biotechnology: Pharmaceutical Preparations
IPA,ImmunoPrecise Antibodies Ltd. Common Stock,$5.38,-0.34,-5.944%,104531732.00,Canada,,41399,,
IPAR,Inter Parfums Inc. Common Stock,$89.975,0.015,0.017%,2855255853.00,United States,,38678,Consumer Non-Durables,Package Goods/Cosmetics
IPAX,Inflection Point Acquisition Corp. Class A Ordinary Share,$9.69,0.02,0.207%,319527750.00,United States,2021,151,,
IPAXU,Inflection Point Acquisition Corp. Units,$9.90,-0.04,-0.402%,0.00,United States,2021,1001,,
IPAXW,Inflection Point Acquisition Corp. Warrants,$0.50,-0.01,-1.961%,0.00,United States,2021,30000,,
IPDN,Professional Diversity Network Inc. Common Stock,$0.888,0.0579,6.975%,14267720.00,United States,2013,86623,Technology,EDP Services
IPGP,IPG Photonics Corporation Common Stock,$145.66,-1.49,-1.013%,7764967965.00,United States,2006,205783,Technology,Semiconductors
IPHA,Innate Pharma S.A. ADS,$3.60,-0.52,-12.621%,285519337.00,France,2019,63269,Health Care,Biotechnology: Pharmaceutical Preparations
IPSC,Century Therapeutics Inc. Common Stock,$12.995,-0.205,-1.553%,734933174.00,United States,2021,98306,Consumer Durables,Specialty Chemicals
IPVI,InterPrivate IV InfraTech Partners Inc. Class A Common Stock,$9.71,0.00,0.00%,348953125.00,United States,2021,3,,
IPVIU,InterPrivate IV InfraTech Partners Inc. Units,$9.80,-0.05,-0.508%,0.00,United States,2021,8805,,
IPVIW,InterPrivate IV InfraTech Partners Inc. Warrant,$0.6097,-0.083,-11.982%,0.00,United States,2021,1301,,
IPW,iPower Inc. Common Stock,$1.48,-0.12,-7.50%,39203249.00,United States,2021,40589,Consumer Services,Catalog/Specialty Distribution
IPWR,Ideal Power Inc. Common Stock,$7.9598,-1.2302,-13.386%,46899508.00,United States,2013,65117,Capital Goods,Industrial Machinery/Components
IQ,iQIYI Inc. American Depositary Shares,$4.04,-0.23,-5.386%,3188711028.00,China,2018,5616143,Technology,Internet and Information Services
IQMD,Intelligent Medicine Acquisition Corp. Class A Common Stock,$9.90,-0.0001,-0.001%,280665000.00,United States,2021,1254,,
IQMDU,Intelligent Medicine Acquisition Corp. Unit,$10.12,-0.02,-0.197%,286902000.00,United States,2021,476,,
IQMDW,Intelligent Medicine Acquisition Corp. Warrant,$0.4333,-0.0067,-1.523%,0.00,United States,2021,66521,,
IRBT,iRobot Corporation Common Stock,$63.05,-1.00,-1.561%,1699719932.00,United States,2005,488138,,
IRCP,IRSA Propiedades Comerciales S.A. American Depositary Shares,$2.09,-0.13,-5.856%,282792683.00,Argentina,,32659,Consumer Services,Building operators
IRDM,Iridium Communications Inc Common Stock,$34.88,-0.52,-1.469%,4611219433.00,United States,,563917,Consumer Services,Telecommunications Equipment
IREN,Iris Energy Limited Ordinary Shares,$9.0101,-0.5699,-5.949%,495880837.00,Australia,2021,141974,,
IRIX,IRIDEX Corporation Common Stock,$4.84,-0.22,-4.348%,76790153.00,United States,1996,29955,Health Care,Biotechnology: Electromedical & Electrotherapeutic Apparatus
IRMD,iRadimed Corporation Common Stock,$37.20,-0.19,-0.508%,459113100.00,United States,2014,70935,Health Care,Medical/Dental Instruments
IROQ,IF Bancorp Inc. Common Stock,$26.32,0.54,2.095%,85642016.00,United States,2011,100,Finance,Finance: Consumer Services
IRTC,iRhythm Technologies Inc. Common Stock,$119.80,-8.92,-6.93%,3525222461.00,United States,2016,273358,Health Care,Medical/Dental Instruments
IRWD,Ironwood Pharmaceuticals Inc. Class A Common Stock,$11.03,0.04,0.364%,1805064872.00,United States,2010,1378825,Health Care,Biotechnology: Pharmaceutical Preparations
ISAA,Iron Spark I Inc. Class A Common Stock,$9.99,0.0099,0.099%,220187592.00,United States,2021,3037,,
ISBC,Investors Bancorp Inc. Common Stock,$15.69,-0.34,-2.121%,3887138427.00,United States,,1229944,Finance,Savings Institutions
ISEE,IVERIC bio Inc. Common Stock,$11.82,-0.33,-2.716%,1355059918.00,United States,2013,635536,Health Care,Biotechnology: Pharmaceutical Preparations
ISIG,Insignia Systems Inc. Common Stock,$15.30,-2.30,-13.068%,27052144.00,United States,1991,182498,Technology,Advertising
ISLE,Isleworth Healthcare Acquisition Corporation Common stock,$9.81,0.00,0.00%,256936163.00,United States,2021,35051,,
ISLEW,Isleworth Healthcare Acquisition Corporation Warrant,$0.4897,-0.0002,-0.041%,0.00,United States,2021,3693,,
ISO,IsoPlexis Corporation Common Stock,$6.07,-0.78,-11.387%,236456528.00,United States,2021,70245,Health Care,Biotechnology: Electromedical & Electrotherapeutic Apparatus
ISPC,iSpecimen Inc. Common Stock,$4.3279,-0.3921,-8.307%,37780542.00,United States,2021,532400,Health Care,Precision Instruments
ISRG,Intuitive Surgical Inc. Common Stock,$257.75,-11.78,-4.371%,92077800923.00,United States,2000,2267069,Health Care,Medical/Dental Instruments
ISSC,Innovative Solutions and Support Inc. Common Stock,$6.20,-0.27,-4.173%,106927506.00,United States,2000,17018,Capital Goods,Military/Government/Technical
ISTR,Investar Holding Corporation Common Stock,$18.73,0.10,0.537%,193733643.00,United States,2014,11366,Finance,Commercial Banks
ISUN,iSun Inc. Common Stock,$4.85,-0.48,-9.006%,57392621.00,United States,2016,174860,Technology,Semiconductors
ITAQU,Industrial Tech Acquisitions II Inc. Unit,$9.9725,-0.0075,-0.075%,0.00,United States,2022,1362,,
ITCI,Intra-Cellular Therapies Inc. Common Stock,$42.25,-0.41,-0.961%,3904560537.00,United States,,839555,Health Care,Biotechnology: Pharmaceutical Preparations
ITHX,ITHAX Acquisition Corp. Class A Ordinary Shares,$9.7702,0.0002,0.002%,301532798.00,United States,2021,5020,Finance,Business Services
ITHXU,ITHAX Acquisition Corp. Unit,$10.05,0.00,0.00%,0.00,United States,2021,1120,Finance,Business Services
ITHXW,ITHAX Acquisition Corp. Warrant,$0.4701,-0.02,-4.081%,0.00,United States,2021,16919,Finance,Business Services
ITI,Iteris Inc. Common Stock,$3.615,-0.165,-4.365%,153029356.00,United States,,208027,Capital Goods,Telecommunications Equipment
ITIC,Investors Title Company Common Stock,$192.99,-0.13,-0.067%,365546605.00,United States,,1605,Finance,Specialty Insurers
ITOS,iTeos Therapeutics Inc. Common Stock,$35.25,-0.84,-2.328%,1243404728.00,United States,2020,130767,Consumer Durables,Specialty Chemicals
ITQ,Itiquira Acquisition Corp. Class A Ordinary Shares,$9.70,-0.05,-0.513%,278875000.00,United States,2021,37751,Finance,Business Services
ITQRU,Itiquira Acquisition Corp. Unit,$9.93,-0.03,-0.301%,0.00,United States,2021,40000,Finance,Business Services
ITQRW,Itiquira Acquisition Corp. Warrant,$0.4281,-0.0616,-12.579%,0.00,United States,2021,15800,Finance,Business Services
ITRI,Itron Inc. Common Stock,$58.80,0.30,0.513%,2662008359.00,United States,1993,155218,Capital Goods,Electrical Products
ITRM,Iterum Therapeutics plc Ordinary Share,$0.288,-0.0461,-13.798%,52639281.00,Ireland,2018,3290142,Health Care,Biotechnology: Pharmaceutical Preparations
ITRN,Ituran Location and Control Ltd. Ordinary Shares,$23.20,-1.01,-4.172%,479947518.00,Israel,2005,14415,Technology,Electronic Components
IVA,Inventiva S.A. American Depository Shares,$11.582,-0.978,-7.787%,471881893.00,France,2020,5968,Consumer Services,Other Consumer Services
IVAC,Intevac Inc. Common Stock,$5.35,-0.10,-1.835%,131561336.00,United States,1995,57542,,
IVCBU,Investcorp Europe Acquisition Corp I Unit,$10.095,0.055,0.548%,0.00,Cayman Islands,2021,100406,,
IVCPU,Swiftmerge Acquisition Corp. Unit,$9.98,0.00,0.00%,0.00,Canada,2021,25,,
IXAQ,IX Acquisition Corp. Class A Ordinary Share,$9.71,0.00,0.00%,279162500.00,United Kingdom,2021,11,,
IXAQU,IX Acquisition Corp. Unit,$10.2439,0.00,0.00%,0.00,United Kingdom,2021,19,,
IZEA,IZEA Worldwide Inc. Common Stock,$0.9536,-0.1264,-11.704%,59123200.00,United States,,756054,Technology,Advertising
JACK,Jack In The Box Inc. Common Stock,$84.60,0.30,0.356%,1777730341.00,United States,,154663,Consumer Services,Restaurants
JAGX,Jaguar Health Inc. Common Stock,$0.7268,-0.0801,-9.927%,33500356.00,United States,2015,909955,Health Care,Biotechnology: Pharmaceutical Preparations
JAKK,JAKKS Pacific Inc. Common Stock,$7.77,-0.41,-5.012%,73842467.00,United States,1996,59060,Consumer Non-Durables,Recreational Products/Toys
JAMF,Jamf Holding Corp. Common Stock,$31.54,-1.13,-3.459%,3754681666.00,United States,2020,196545,Technology,Computer Software: Prepackaged Software
JAN,JanOne Inc. Common Stock (NV),$2.72,-0.05,-1.805%,7690555.00,United States,,37488,Public Utilities,Environmental Services
JANX,Janux Therapeutics Inc. Common Stock,$13.985,0.005,0.036%,581936967.00,United States,2021,22936,Health Care,Biotechnology: Pharmaceutical Preparations
JAQC,Jupiter Acquisition Corporation Common stock,$9.57,-0.03,-0.313%,194247544.00,United States,2021,4779,,
JAQCW,Jupiter Acquisition Corporation Warrants,$0.4778,-0.0009,-0.188%,0.00,United States,2021,3683,,
JAZZ,Jazz Pharmaceuticals plc Common Stock (Ireland),$130.79,-5.97,-4.365%,8039614870.00,Ireland,2007,348468,Health Care,Biotechnology: Pharmaceutical Preparations
JBHT,J.B. Hunt Transport Services Inc. Common Stock,$199.25,0.30,0.151%,20939979500.00,United States,,399094,Transportation,Trucking Freight/Courier Services
JBLU,JetBlue Airways Corporation Common Stock,$13.085,-0.685,-4.975%,4161429354.00,United States,2002,6048987,Transportation,Air Freight/Delivery Services
JBSS,John B. Sanfilippo & Son Inc. Common Stock,$85.99,-0.01,-0.012%,986262821.00,United States,1991,30175,Consumer Non-Durables,Specialty Foods
JCIC,Jack Creek Investment Corp. Class A Ordinary Shares,$9.72,-0.02,-0.205%,419175000.00,United States,2021,63431,Finance,Business Services
JCICU,Jack Creek Investment Corp. Units,$9.92,-0.05,-0.502%,0.00,United States,2021,890,Finance,Business Services
JCICW,Jack Creek Investment Corp. Warrants,$0.4189,-0.0012,-0.286%,0.00,United States,2021,5549,Finance,Business Services
JCS,Communications Systems Inc. Common Stock,$2.02,-0.2105,-9.437%,19635667.00,United States,,90709,Public Utilities,Telecommunications Equipment
JCTCF,Jewett-Cameron Trading Company Common Shares,$7.78,0.00,0.00%,27174311.00,United States,,116,,
JD,JD.com Inc. American Depositary Shares,$69.345,-4.115,-5.602%,107711473478.00,China,2014,7870481,Miscellaneous,Diversified Commercial Services
JFIN,Jiayin Group Inc. American Depositary Shares,$1.7609,-0.2391,-11.955%,95132623.00,China,2019,74963,Finance,Finance: Consumer Services
JFU,9F Inc. American Depositary Shares,$0.95,-0.13,-12.037%,219757491.00,China,2019,225101,Finance,Finance: Consumer Services
JG,Aurora Mobile Limited American Depositary Shares,$0.8168,-0.1314,-13.858%,96730159.00,China,2018,248370,Technology,EDP Services
JJSF,J & J Snack Foods Corp. Common Stock,$149.79,-0.30,-0.20%,2859316145.00,United States,1986,24418,Consumer Non-Durables,Specialty Foods
JKHY,Jack Henry & Associates Inc. Common Stock,$161.55,-2.19,-1.337%,11961328720.00,United States,1985,206398,Technology,Retail: Computer Software & Peripheral Equipment
JMAC,Maxpro Capital Acquisition Corp. Class A Common Stock,$9.94,0.00,0.00%,136332319.00,Taiwan,2021,3713,,
JMACU,Maxpro Capital Acquisition Corp. Units,$10.22,0.00,0.00%,0.00,Taiwan,2021,67,,
JMACW,Maxpro Capital Acquisition Corp. Warrants,$0.28,-0.0301,-9.707%,0.00,Taiwan,2021,108459,,
JNCE,Jounce Therapeutics Inc. Common Stock,$6.32,0.15,2.431%,323859482.00,United States,2017,356231,Health Care,Biotechnology: Pharmaceutical Preparations
JOAN,JOANN Inc. Common Stock,$9.38,0.34,3.761%,386277489.00,United States,2021,272160,Consumer Non-Durables,Department/Specialty Retail Stores
JOBS,51job Inc. American Depositary Shares,$49.035,-2.765,-5.338%,3306783543.00,China,2004,165453,Technology,Diversified Commercial Services
JOFF,JOFF Fintech Acquisition Corp. Class A Common Stock,$9.71,-0.02,-0.206%,502492500.00,United States,2021,1569329,,
JOFFU,JOFF Fintech Acquisition Corp. Unit,$9.85,-0.05,-0.505%,0.00,United States,2021,21707,,
JOFFW,JOFF Fintech Acquisition Corp. Warrant,$0.45,-0.0004,-0.089%,0.00,United States,2021,26117,,
JOUT,Johnson Outdoors Inc. Class A Common Stock,$84.35,0.09,0.107%,860415380.00,United States,,14222,Consumer Non-Durables,Recreational Products/Toys
JRSH,Jerash Holdings (US) Inc. Common Stock,$6.50,-0.01,-0.154%,80173067.00,United States,2018,4047,Basic Industries,Industrial Specialties
JRVR,James River Group Holdings Ltd. Common Shares,$26.8486,-0.1214,-0.45%,1001215143.00,Bermuda,2014,75855,Finance,Property-Casualty Insurers
JSM,Navient Corporation 6% Senior Notes due December 15 2043,$24.91,-0.178,-0.71%,0.00,United States,,41752,Finance,Finance: Consumer Services
JSPR,Jasper Therapeutics Inc. Common Stock,$4.13,-0.25,-5.708%,156333865.00,United States,2020,53985,Health Care,Biotechnology: Pharmaceutical Preparations
JSPRW,Japer Therapeutics Inc. Warrants,$0.61,0.00,0.00%,0.00,United States,2020,5,Health Care,Biotechnology: Pharmaceutical Preparations
JUGG,Jaws Juggernaut Acquisition Corporation Class A Ordinary Share,$9.70,-0.03,-0.308%,334650000.00,United States,2021,79704,,
JUGGU,Jaws Juggernaut Acquisition Corporation Unit,$9.90,-0.05,-0.503%,0.00,United States,2021,501,,
JUGGW,Jaws Juggernaut Acquisition Corporation Warrant,$0.75,-0.0501,-6.262%,0.00,United States,2021,10283,,
JUPW,Jupiter Wellness Inc. Common Stock,$0.6397,-0.0974,-13.214%,15174324.00,United States,2020,237524,Health Care,Biotechnology: Pharmaceutical Preparations
JUPWW,Jupiter Wellness Inc. Warrant,$0.82,0.15,22.388%,0.00,United States,2020,10190,Health Care,Biotechnology: Pharmaceutical Preparations
JVA,Coffee Holding Co. Inc. Common Stock,$4.445,-0.105,-2.308%,25374723.00,United States,2005,18694,Consumer Non-Durables,Specialty Foods
JWAC,Jupiter Wellness Acquisition Corp. Class A Common Stock,$9.85,0.02,0.203%,0.00,United States,2022,142691,,
JWACR,Jupiter Wellness Acquisition Corp. Right,$0.25,-0.0311,-11.064%,0.00,United States,2022,17700,,
JWEL,Jowell Global Ltd. Ordinary Shares,$3.60,-0.27,-6.977%,91695074.00,China,2021,303428,Consumer Services,Other Consumer Services
JYAC,Jiya Acquisition Corp. Class A Common Stock,$9.7567,-0.0483,-0.493%,131199233.00,United States,2020,1275,,
JYNT,The Joint Corp. Common Stock,$50.20,-0.89,-1.742%,723549618.00,United States,2014,92704,,
JZXN,Jiuzi Holdings Inc. Ordinary Shares,$1.32,-0.08,-5.714%,28283434.00,China,2021,212357,Consumer Durables,Automotive Aftermarket
KACL,Kairous Acquisition Corp. Limited Ordinary Shares,$9.80,0.00,0.00%,0.00,Malaysia,2022,300500,,
KACLU,Kairous Acquisition Corp. Limited Unit,$10.11,0.02,0.198%,0.00,Malaysia,2021,47271,,
KACLW,Kairous Acquisition Corp. Limited Warrants,$0.40,0.40,,0.00,Malaysia,2022,102,,
KAII,Kismet Acquisition Two Corp. Class A Ordinary Shares,$9.70,0.00,0.00%,283725000.00,United States,2021,7,Finance,Business Services
KAIIU,Kismet Acquisition Two Corp. Unit,$9.8601,-0.0399,-0.403%,0.00,United States,2021,410,Finance,Business Services
KAIIW,Kismet Acquisition Two Corp. Warrant,$0.4808,-0.0026,-0.538%,0.00,United States,2021,20987,Finance,Business Services
KAIR,Kairos Acquisition Corp. Class A Ordinary Shares,$9.74,0.00,0.00%,336030000.00,United States,2021,58,Finance,Business Services
KAIRU,Kairos Acquisition Corp. Unit,$9.93,-0.05,-0.501%,0.00,United States,2021,317,Finance,Business Services
KAIRW,Kairos Acquisition Corp. Warrant,$0.4613,0.0013,0.283%,0.00,United States,2021,49250,Finance,Business Services
KALA,Kala Pharmaceuticals Inc. Common Stock,$0.7807,-0.0298,-3.677%,43765937.00,United States,2017,535996,Health Care,Biotechnology: Pharmaceutical Preparations
KALU,Kaiser Aluminum Corporation Common Stock,$96.42,-1.39,-1.421%,1529478834.00,United States,,35212,Basic Industries,Aluminum
KALV,KalVista Pharmaceuticals Inc. Common Stock,$11.19,-0.42,-3.618%,273817073.00,United Kingdom,2015,52570,Health Care,Biotechnology: Pharmaceutical Preparations
KARO,Karooooo Ltd. Ordinary Shares,$35.00,-1.00,-2.778%,1083288710.00,Singapore,2021,5516,Technology,Computer Software: Prepackaged Software
KAVL,Kaival Brands Innovations Group Inc. Common Stock,$0.5699,-0.0711,-11.092%,16144234.00,United States,,381672,Consumer Non-Durables,Farming/Seeds/Milling
KBAL,Kimball International Inc. Class B Common Stock,$9.86,0.07,0.715%,360539498.00,United States,,73178,Consumer Durables,Industrial Specialties
KBNT,Kubient Inc. Common Stock,$1.8436,-0.3264,-15.041%,26276621.00,United States,2020,196036,Technology,EDP Services
KBNTW,Kubient Inc. Warrant,$0.55,-0.0574,-9.45%,0.00,United States,2020,10202,Technology,EDP Services
KC,Kingsoft Cloud Holdings Limited American Depositary Shares,$10.27,-0.41,-3.839%,2481941996.00,China,2020,1712078,Technology,Computer Software: Prepackaged Software
KDNY,Chinook Therapeutics Inc. Common Stock,$12.09,-0.63,-4.953%,660250218.00,United States,2015,200548,Health Care,Biotechnology: Pharmaceutical Preparations
KDP,Keurig Dr Pepper Inc. Common Stock,$37.93,0.10,0.264%,53783283260.00,United States,,3675910,Consumer Non-Durables,Beverages (Production/Distribution)
KE,Kimball Electronics Inc. Common Stock,$19.46,-0.30,-1.518%,488463728.00,United States,,35922,Capital Goods,Industrial Machinery/Components
KELYA,Kelly Services Inc. Class A Common Stock,$17.125,0.255,1.512%,674616667.00,United States,,41550,Technology,Diversified Commercial Services
KELYB,Kelly Services Inc. Class B Common Stock,$17.00,0.00,0.00%,669692458.00,United States,,182,Technology,Diversified Commercial Services
KEQU,Kewaunee Scientific Corporation Common Stock,$12.825,-0.025,-0.195%,35780121.00,United States,,1735,Capital Goods,Medical Specialities
KERN,Akerna Corp. Common Stock,$1.31,-0.14,-9.655%,18416906.00,United States,2018,447874,Health Care,Managed Health Care
KERNW,Akerna Corp Warrant,$0.1647,-0.0202,-10.925%,0.00,United States,2018,12327,Health Care,Managed Health Care
KFFB,Kentucky First Federal Bancorp Common Stock,$7.40,-0.0084,-0.113%,60814791.00,United States,,270,Finance,Savings Institutions
KFRC,Kforce Inc. Common Stock,$68.76,0.31,0.453%,1473123798.00,United States,1995,38444,Technology,Diversified Commercial Services
KHC,The Kraft Heinz Company Common Stock,$36.155,-0.845,-2.284%,44255255177.00,United States,,4674322,Consumer Non-Durables,Farming/Seeds/Milling
KIDS,OrthoPediatrics Corp. Common Stock,$47.805,0.265,0.557%,940724956.00,United States,2017,37125,Health Care,Medical/Dental Instruments
KIII,Kismet Acquisition Three Corp. Class A Ordinary Shares,$9.68,-0.02,-0.206%,352715000.00,United States,2021,3091,Finance,Business Services
KIIIU,Kismet Acquisition Three Corp. Unit,$9.845,0.095,0.974%,0.00,United States,2021,302,Finance,Business Services
KIIIW,Kismet Acquisition Three Corp. Warrant,$0.4614,-0.0171,-3.574%,0.00,United States,2021,27916,Finance,Business Services
KINS,Kingstone Companies Inc. Common Stock,$5.105,-0.25,-4.669%,53516389.00,United States,,6892,Finance,Specialty Insurers
KINZ,KINS Technology Group Inc. Class A Common Stock,$9.98,0.00,0.00%,344310000.00,United States,2021,12525,,
KINZU,KINS Technology Group Inc. Unit,$10.18,0.05,0.494%,0.00,United States,2020,6097,,
KINZW,KINS Technology Group Inc. Warrant,$0.45,-0.0143,-3.08%,0.00,United States,2021,82930,,
KIRK,Kirkland's Inc. COMMONSTOCK,$15.42,0.04,0.26%,198846328.00,United States,2002,177149,Miscellaneous,Diversified Commercial Services
KLAC,KLA Corporation Common Stock,$376.08,3.05,0.818%,57022063813.00,United States,1980,1044622,Capital Goods,Electronic Components
KLAQ,KL Acquisition Corp Class A Common Stock,$9.75,0.01,0.103%,350390625.00,United States,2021,102,,
KLAQU,KL Acquisition Corp Unit,$9.87,0.00,0.00%,0.00,United States,2021,3,,
KLAQW,KL Acquisition Corp Warrant,$0.50,0.00,0.00%,0.00,United States,2021,69109,,
KLDO,Kaleido Biosciences Inc. Common Stock,$1.93,-0.23,-10.648%,82207096.00,United States,2019,98831,Health Care,Biotechnology: Biological Products (No Diagnostic Substances)
KLIC,Kulicke and Soffa Industries Inc. Common Stock,$51.61,-0.87,-1.658%,3223694992.00,Singapore,,612239,Technology,Semiconductors
KLTR,Kaltura Inc. Common Stock,$3.17,-0.02,-0.627%,402191984.00,United States,2021,396755,Technology,EDP Services
KLXE,KLX Energy Services Holdings Inc. Common Stock,$4.4311,-0.5389,-10.843%,45847883.00,United States,,468528,Energy,Oilfield Services/Equipment
KMDA,Kamada Ltd. Ordinary Shares,$5.89,-0.36,-5.76%,263791372.00,Israel,2013,89397,Health Care,Biotechnology: Pharmaceutical Preparations
KMPH,KemPharm Inc. Common Stock,$6.305,-0.175,-2.701%,222688981.00,United States,,519294,Health Care,Biotechnology: Pharmaceutical Preparations
KNBE,KnowBe4 Inc. Class A Common Stock,$20.44,-0.21,-1.017%,3503696580.00,United States,2021,466301,Technology,Computer Software: Prepackaged Software
KNDI,Kandi Technologies Group Inc Common Stock,$2.805,-0.195,-6.50%,217065290.00,China,,1144447,Capital Goods,Auto Parts:O.E.M.
KNSA,Kiniksa Pharmaceuticals Ltd. Class A Common Stock,$10.10,-0.27,-2.604%,695773194.00,United States,2018,282725,Health Care,Biotechnology: Pharmaceutical Preparations
KNTE,Kinnate Biopharma Inc. Common Stock,$11.845,-0.715,-5.693%,517580245.00,United States,2020,23441,Health Care,Biotechnology: Pharmaceutical Preparations
KOD,Kodiak Sciences Inc Common Stock,$58.0575,0.2575,0.446%,3002576332.00,United States,2018,792476,Health Care,Biotechnology: Pharmaceutical Preparations
KOPN,Kopin Corporation Common Stock,$2.9241,-0.2459,-7.757%,269573381.00,United States,1992,1338506,Capital Goods,Industrial Machinery/Components
KOSS,Koss Corporation Common Stock,$7.995,-0.745,-8.524%,73056671.00,United States,,77324,Consumer Non-Durables,Consumer Electronics/Appliances
KPLT,Katapult Holdings Inc. Common Stock,$2.16,-0.22,-9.244%,210540321.00,United States,2019,1305845,Technology,EDP Services
KPLTW,Katapult Holdings Inc. Warrant,$0.345,-0.0383,-9.992%,0.00,United States,2019,87738,Technology,EDP Services
KPRX,Kiora Pharmaceuticals Inc.  Common Stock,$0.66,-0.0301,-4.362%,8351016.00,United States,,179938,Health Care,Biotechnology: In Vitro & In Vivo Diagnostic Substances
KPTI,Karyopharm Therapeutics Inc. Common Stock,$7.90,-0.38,-4.589%,596825234.00,United States,2013,1274130,Miscellaneous,Diversified Commercial Services
KRBP,Kiromic BioPharma Inc. Common Stock,$1.0696,-0.1704,-13.742%,16512152.00,United States,2020,40466,Consumer Durables,Specialty Chemicals
KRKR,36Kr Holdings Inc. American Depositary Shares,$0.96,-0.10,-9.434%,37012601.00,China,2019,145150,Miscellaneous,Business Services
KRMD,Repro Med Systems Inc. Common Stock,$2.65,-0.10,-3.636%,118252699.00,United States,,43634,Health Care,Medical/Dental Instruments
KRNL,Kernel Group Holdings Inc. Class A Ordinary Shares,$9.71,-0.01,-0.103%,369890313.00,United States,2021,456,Finance,Business Services
KRNLU,Kernel Group Holdings Inc. Units,$9.88,-0.02,-0.202%,0.00,United States,2021,581,Finance,Business Services
