Symbol,Name,Last Sale,Net Change,% Change,Market Cap,Country,IPO Year,Volume,Sector,Industry
RAMMW,Aries I Acquisition Corporation Warrant,$0.50,-0.1098,-18.006%,0.00,Cayman Islands,2021,121797,Finance,Business Services
RAND,Rand Capital Corporation Common Stock,$15.5001,-1.0699,-6.457%,40006084.00,United States,,9482,Finance,Finance/Investors Services
RANI,Rani Therapeutics Holdings Inc. Class A Common Stock,$18.555,-0.325,-1.721%,365753822.00,United States,2021,9702,Consumer Durables,Specialty Chemicals
RAPT,RAPT Therapeutics Inc. Common Stock,$20.58,-0.42,-2.00%,608057874.00,United States,2019,166332,Health Care,Biotechnology: Pharmaceutical Preparations
RARE,Ultragenyx Pharmaceutical Inc. Common Stock,$64.17,-3.00,-4.466%,4373969978.00,United States,2014,118327,Health Care,Biotechnology: Pharmaceutical Preparations
RAVE,Rave Restaurant Group Inc. Common Stock,$0.9201,-0.0599,-6.112%,16566312.00,United States,,155185,Consumer Services,Restaurants
RBB,RBB Bancorp Common Stock,$26.645,0.185,0.699%,520014291.00,United States,2017,7128,Finance,Commercial Banks
RBBN,Ribbon Communications Inc. Common Stock,$4.36,-0.095,-2.132%,648004542.00,United States,,256456,Technology,EDP Services
RBCAA,Republic Bancorp Inc. Class A Common Stock,$49.38,-0.13,-0.263%,997871435.00,United States,1998,7688,Finance,Major Banks
RBCN,Rubicon Technology Inc. Common Stock,$8.8492,-0.1308,-1.457%,21642320.00,United States,2007,2519,Technology,Semiconductors
RBKB,Rhinebeck Bancorp Inc. Common Stock,$10.6601,-0.0399,-0.373%,120424698.00,United States,2019,6078,Finance,Major Banks
RCACU,Revelstone Capital Acquisition Corp. Unit,$9.88,-0.045,-0.453%,0.00,United States,2021,13545,,
RCAT,Red Cat Holdings Inc. Common Stock,$1.53,-0.15,-8.929%,82368436.00,United States,,558536,Technology,Retail: Computer Software & Peripheral Equipment
RCEL,Avita Medical Inc. Common Stock,$9.20,-0.36,-3.766%,229311086.00,United States,,44427,Health Care,Medical Specialities
RCHG,Recharge Acquisition Corp. Class A Common Stock,$9.90,0.01,0.101%,247995000.00,United States,2020,20848,,
RCHGU,Recharge Acquisition Corp. Unit,$10.00,-0.115,-1.137%,0.00,United States,2020,5671,,
RCHGW,Recharge Acquisition Corp. Warrant,$0.4498,-0.0039,-0.86%,0.00,United States,2020,36645,,
RCII,Rent-A-Center Inc. Common Stock,$43.4589,2.2989,5.585%,2874381989.00,United States,1995,463059,Technology,Diversified Commercial Services
RCKT,Rocket Pharmaceuticals Inc. Common Stock,$15.25,-0.44,-2.804%,982749665.00,United States,2015,222130,Health Care,Biotechnology: Pharmaceutical Preparations
RCKY,Rocky Brands Inc. Common Stock,$40.54,0.59,1.477%,295950067.00,United States,1993,25248,Consumer Non-Durables,Shoe Manufacturing
RCLF,Rosecliff Acquisition Corp I Class A Common Stock,$9.80,-0.02,-0.204%,309925000.00,United States,2021,13971,,
RCLFU,Rosecliff Acquisition Corp I Unit,$9.98,0.00,0.00%,0.00,United States,2021,41,,
RCLFW,Rosecliff Acquisition Corp I Warrants,$0.5103,-0.0798,-13.523%,0.00,United States,2021,5904,,
RCM,R1 RCM Inc. Common Stock,$21.40,-0.14,-0.65%,5954041579.00,United States,,605445,Consumer Services,Other Consumer Services
RCMT,RCM Technologies Inc. Common Stock,$5.55,-0.52,-8.567%,58186289.00,United States,,107826,Consumer Services,Military/Government/Technical
RCON,Recon Technology Ltd. Class A Ordinary Shares,$0.96,-0.10,-9.434%,6914719.00,China,2009,418900,Energy,Oilfield Services/Equipment
RCRT,Recruiter.com Group Inc. Common Stock,$2.0557,-0.1543,-6.982%,29928772.00,United States,,49073,,
RCRTW,Recruiter.com Group Inc. Warrant,$0.71,-0.04,-5.333%,0.00,United States,,3700,,
RDBX,Redbox Entertainment Inc. Class A Common Stock,$5.185,-0.515,-9.035%,65427005.00,United States,2020,86735,,
RDBXW,Redbox Entertainment Inc. Warrant,$0.65,-0.104,-13.793%,0.00,United States,2020,15111,,
RDCM,Radcom Ltd. Ordinary Shares,$11.40,-0.86,-7.015%,158957678.00,Israel,1997,9078,Technology,Computer peripheral equipment
RDFN,Redfin Corporation Common Stock,$26.1701,-2.5599,-8.91%,2760457425.00,United States,2017,1641126,Finance,Real Estate
RDHL,Redhill Biopharma Ltd. American Depositary Shares,$2.31,-0.30,-11.494%,118759812.00,Israel,,377870,Health Care,Biotechnology: Pharmaceutical Preparations
RDI,Reading International Inc Class A Common Stock,$4.20,-0.09,-2.098%,91599501.00,United States,,35600,Consumer Services,Movies/Entertainment
RDIB,Reading International Inc Class B Common Stock,$23.28,-1.02,-4.198%,507722948.00,United States,,2294,Consumer Services,Movies/Entertainment
RDNT,RadNet Inc. Common Stock,$25.56,-0.84,-3.182%,1365842001.00,United States,,114707,Health Care,Medical Specialities
RDUS,Radius Health Inc. Common Stock,$6.70,0.23,3.555%,317192807.00,United States,2014,584010,Health Care,Biotechnology: Pharmaceutical Preparations
RDVT,Red Violet Inc. Common Stock ,$27.90,-0.96,-3.326%,374374448.00,United States,,38185,Technology,Computer Software: Prepackaged Software
RDWR,Radware Ltd. Ordinary Shares,$31.93,-0.44,-1.359%,1468738842.00,Israel,1999,175632,Miscellaneous,Business Services
REAL,The RealReal Inc. Common Stock,$8.78,-0.47,-5.081%,811165024.00,United States,2019,1814108,Consumer Non-Durables,Consumer Specialties
REAX,The Real Brokerage Inc. Common Shares,$2.15,-0.14,-6.114%,383044000.00,Canada,,413747,,
REDU,RISE Education Cayman Ltd American Depositary Shares,$0.469,-0.031,-6.20%,26490483.00,China,2017,347226,Miscellaneous,Service to the Health Industry
REE,REE Automotive Ltd. Class A Ordinary Shares,$4.31,-0.09,-2.045%,990982060.00,Israel,,1030166,,
REEAW,REE Automotive Ltd. Warrant,$0.7792,-0.1108,-12.449%,0.00,Israel,,15460,,
REED,Reeds Inc. Common Stock,$0.2901,-0.0224,-7.168%,27190879.00,United States,,427127,Consumer Non-Durables,Beverages (Production/Distribution)
REFI,Chicago Atlantic Real Estate Finance Inc. Common Stock,$18.68,-0.27,-1.425%,326032314.00,United States,2021,35729,Consumer Services,Real Estate Investment Trusts
REFR,Research Frontiers Incorporated Common Stock,$1.395,-0.125,-8.224%,44152302.00,United States,,92276,Capital Goods,Industrial Machinery/Components
REG,Regency Centers Corporation Common Stock,$68.45,-1.54,-2.20%,11719530055.00,United States,1993,512897,Consumer Services,Real Estate Investment Trusts
REGI,Renewable Energy Group Inc. Common Stock,$39.24,-0.39,-0.984%,1972614498.00,United States,2012,312570,Basic Industries,Major Chemicals
REGN,Regeneron Pharmaceuticals Inc. Common Stock,$608.65,-12.75,-2.052%,65456057906.00,United States,1991,552537,Health Care,Biotechnology: Pharmaceutical Preparations
REKR,Rekor Systems Inc. Common Stock,$4.27,-0.13,-2.955%,187782721.00,United States,,374139,Technology,EDP Services
RELI,Reliance Global Group Inc. Common Stock,$5.7888,-0.9212,-13.729%,63422724.00,United States,,936284,Finance,Specialty Insurers
RELIW,Reliance Global Group Inc. Series A Warrants,$1.1599,-0.3101,-21.095%,0.00,United States,,22804,Finance,Specialty Insurers
RELL,Richardson Electronics Ltd. Common Stock,$12.655,-0.305,-2.353%,171111507.00,United States,1983,124832,Technology,Electronic Components
RELY,Remitly Global Inc. Common Stock,$12.58,-0.59,-4.48%,2064459518.00,United States,2021,296554,Technology,Computer Software: Prepackaged Software
RENO,Renovare Environmental Inc.  Common Stock,$0.4999,-0.0577,-10.348%,14717671.00,United States,,156072,Capital Goods,Industrial Machinery/Components
RENT,Rent the Runway Inc. Class A Common Stock,$4.96,0.23,4.863%,312659825.00,United States,2021,577978,Consumer Non-Durables,Department/Specialty Retail Stores
REPH,Recro Pharma Inc. Common Stock,$1.54,-0.09,-5.521%,71786384.00,United States,2014,188920,Health Care,Biotechnology: Pharmaceutical Preparations
REPL,Replimune Group Inc. Common Stock,$19.96,-0.80,-3.854%,935993701.00,United States,2018,88974,Health Care,Biotechnology: Pharmaceutical Preparations
RESN,Resonant Inc. Common Stock,$1.225,-0.095,-7.197%,80495475.00,United States,2014,587166,Technology,Semiconductors
RETA,Reata Pharmaceuticals Inc. Class A Common Stock,$24.53,-1.65,-6.303%,892691516.00,United States,2016,319706,Health Care,Biotechnology: Pharmaceutical Preparations
RETO,ReTo Eco-Solutions Inc. Common Shares,$0.77,-0.97,-55.747%,21236216.00,China,2017,13239463,Capital Goods,Multi-Sector Companies
REVB,Revelation Biosciences Inc. Common Stock,$2.86,-0.43,-13.07%,37020449.00,United States,2020,126052,Health Care,Biotechnology: Pharmaceutical Preparations
REVBU,Revelation Biosciences Inc. Unit,$10.01,0.00,0.00%,0.00,United States,2020,1,Health Care,Biotechnology: Pharmaceutical Preparations
REVBW,Revelation Biosciences Inc. Warrant,$0.32,-0.0199,-5.855%,0.00,United States,2020,5060,Health Care,Biotechnology: Pharmaceutical Preparations
REVE,Alpine Acquisition Corporation Common Stock,$10.00,-0.03,-0.299%,135750000.00,United States,2021,102,,
REVEU,Alpine Acquisition Corporation Unit,$10.07,0.00,0.00%,0.00,United States,2021,100,,
REVEW,Alpine Acquisition Corporation Warrant,$0.3351,-0.0747,-18.228%,0.00,United States,2021,59463,,
REVH,Revolution Healthcare Acquisition Corp. SAIL Class A Common Stock,$9.68,-0.04,-0.412%,559020000.00,United States,2021,7280,,
REVHU,Revolution Healthcare Acquisition Corp. SAIL Units,$9.83,-0.035,-0.355%,0.00,United States,2021,6407,,
REVHW,Revolution Healthcare Acquisition Corp. SAIL Warrant.,$0.50,-0.0898,-15.226%,0.00,United States,2021,111643,,
REYN,Reynolds Consumer Products Inc. Common Stock,$30.90,-0.10,-0.323%,6481598585.00,United States,2020,327332,Capital Goods,Office Equipment/Supplies/Services
RFIL,RF Industries Ltd. Common Stock,$6.655,-0.375,-5.334%,66939790.00,United States,,21312,Capital Goods,Electrical Products
RGC,Regencell Bioscience Holdings Limited Ordinary Shares,$25.40,-1.57,-5.821%,329364467.00,Hong Kong,2021,13858,,
RGCO,RGC Resources Inc. Common Stock,$22.43,0.0299,0.133%,188102197.00,United States,,5901,Public Utilities,Oil & Gas Production
RGEN,Repligen Corporation Common Stock,$179.0706,-4.7394,-2.578%,9900549882.00,United States,1986,294419,Health Care,Medical/Dental Instruments
RGF,The Real Good Food Company Inc. Class A Common Stock,$5.8143,-0.7957,-12.038%,149704073.00,United States,2021,81593,Consumer Non-Durables,Food Distributors
RGLD,Royal Gold Inc. Common Stock,$101.7471,-0.5029,-0.492%,6678404011.00,United States,,366382,,
RGLS,Regulus Therapeutics Inc. Common Stock,$0.204,-0.02,-8.929%,29778122.00,United States,2012,1797388,Health Care,Biotechnology: Pharmaceutical Preparations
RGNX,REGENXBIO Inc. Common Stock,$24.79,-0.12,-0.482%,1060248666.00,United States,2015,218705,Health Care,Biotechnology: Biological Products (No Diagnostic Substances)
RGP,Resources Connection Inc. Common Stock,$17.62,0.18,1.032%,573129440.00,United States,,125992,Miscellaneous,Business Services
RIBT,RiceBran Technologies Common Stock,$0.28,-0.02,-6.667%,14272623.00,United States,,325050,Consumer Non-Durables,Specialty Foods
RICK,RCI Hospitality Holdings Inc. Common Stock,$68.88,-3.51,-4.849%,654353801.00,United States,1995,58443,Consumer Services,Restaurants
RICOW,Agrico Acquisition Corp. Warrant,$0.34,-0.058,-14.573%,0.00,Cayman Islands,2021,100,,
RIDE,Lordstown Motors Corp. Class A Common Stock,$2.30,-0.165,-6.694%,442131077.00,United States,2019,5899712,Capital Goods,Construction/Ag Equipment/Trucks
RIGL,Rigel Pharmaceuticals Inc. Common Stock,$2.285,-0.145,-5.967%,390748849.00,United States,2000,920609,Health Care,Biotechnology: Pharmaceutical Preparations
RILY,B. Riley Financial Inc. Common Stock,$57.99,-2.69,-4.433%,1598758378.00,United States,,251563,Finance,Investment Managers
RILYG,B. Riley Financial Inc. 5.00% Senior Notes due 2026,$24.75,-0.25,-1.00%,0.00,United States,,31598,Miscellaneous,Business Services
RILYK,B. Riley Financial Inc. 5.50% Senior Notes Due 2026,$25.50,0.08,0.315%,0.00,United States,,2013,Miscellaneous,Business Services
RILYL,B. Riley Financial Inc. Depositary Shares each representing 1/1000th in a share of 7.375% Series B Cumulative Perpetual Preferred Stock par value $0.0001,$26.83,-0.12,-0.445%,0.00,United States,,3206,Finance,Investment Managers
RILYM,B. Riley Financial Inc. 6.375% Senior Notes due 2025,$25.37,-0.18,-0.705%,0.00,United States,,10883,Miscellaneous,Business Services
RILYN,B. Riley Financial Inc. 6.50% Senior Notes Due 2026,$25.65,-0.10,-0.388%,0.00,United States,,6789,Miscellaneous,Business Services
RILYO,B. Riley Financial Inc. 6.75% Senior Notes due 2024,$25.52,-0.05,-0.196%,0.00,United States,,3479,Miscellaneous,Business Services
RILYP,B. Riley Financial Inc. Depositary Shares each representing a 1/1000th fractional interest in a share of Series A Cumulative Perpetual Preferred Stock,$26.0648,-0.3752,-1.419%,0.00,United States,,6600,Finance,Investment Managers
RILYT,B. Riley Financial Inc. 6.00% Senior Notes Due 2028,$24.93,-0.29,-1.15%,0.00,United States,,29796,Miscellaneous,Business Services
RILYZ,B. Riley Financial Inc. 5.25% Senior Notes due 2028,$24.25,-0.25,-1.02%,0.00,United States,,49562,Miscellaneous,Business Services
RIOT,Riot Blockchain Inc.  Common Stock ,$13.93,-1.065,-7.102%,1624006762.00,United States,,13517032,Technology,Retail: Computer Software & Peripheral Equipment
RIVN,Rivian Automotive Inc. Class A Common Stock,$57.7198,-6.7902,-10.526%,51966137840.00,United States,2021,15608431,Capital Goods,Auto Manufacturing
RKDA,Arcadia Biosciences Inc. Common Stock,$0.8082,-0.1318,-14.021%,17929299.00,United States,2015,658789,Basic Industries,Agricultural Chemicals
RKLB,Rocket Lab USA Inc. Common Stock,$8.27,-0.73,-8.111%,3729153033.00,United States,2020,3445546,Capital Goods,Aerospace
RKLBW,Rocket Lab USA Inc. Warrant,$2.31,-0.27,-10.465%,0.00,United States,2020,12574,Capital Goods,Aerospace
RLAY,Relay Therapeutics Inc. Common Stock,$21.96,-0.19,-0.858%,2372649380.00,United States,2020,354348,Health Care,Biotechnology: Pharmaceutical Preparations
RLMD,Relmada Therapeutics Inc. Common Stock,$17.85,-0.72,-3.877%,494910599.00,United States,,52396,Health Care,Biotechnology: Pharmaceutical Preparations
RLYB,Rallybio Corporation Common Stock,$8.83,-0.37,-4.022%,283707635.00,United States,2021,16315,Health Care,Biotechnology: Pharmaceutical Preparations
RMBI,Richmond Mutual Bancorporation Inc. Common Stock,$16.429,0.509,3.197%,204121930.00,United States,2019,1073,,
RMBL,RumbleOn Inc. Class B Common Stock,$31.91,-1.90,-5.62%,476480822.00,United States,,82606,Capital Goods,Automotive Aftermarket
RMBS,Rambus Inc. Common Stock,$23.985,-0.615,-2.50%,2623113984.00,United States,1997,394981,Technology,Semiconductors
RMCF,Rocky Mountain Chocolate Factory Inc. Common Stock,$7.69,-0.11,-1.41%,47522970.00,United States,,5576,Consumer Non-Durables,Specialty Foods
RMGC,RMG Acquisition Corp. III Class A Ordinary Shares,$9.72,-0.01,-0.103%,586845000.00,United States,2021,5223,Finance,Business Services
RMGCU,RMG Acquisition Corp. III Unit,$9.93,0.00,0.00%,0.00,United States,2021,1021,Finance,Business Services
RMGCW,RMG Acquisition Corp. III Warrant,$0.65,-0.01,-1.515%,0.00,United States,2021,25380,Finance,Business Services
RMNI,Rimini Street Inc. (DE) Common Stock,$5.08,0.05,0.994%,441639960.00,United States,2015,494132,Technology,EDP Services
RMR,The RMR Group Inc. Class A Common Stock,$31.06,-1.05,-3.27%,512024442.00,United States,,44512,Finance,Real Estate
RMTI,Rockwell Medical Inc. (DE) Common Stock,$0.3612,-0.0318,-8.092%,33940657.00,United States,1998,579781,Health Care,Biotechnology: Pharmaceutical Preparations
RNA,Avidity Biosciences Inc. Common Stock,$13.91,-0.31,-2.18%,652338425.00,United States,2020,91231,Health Care,Biotechnology: Pharmaceutical Preparations
RNAZ,TransCode Therapeutics Inc. Common Stock,$2.03,0.00,0.00%,26196285.00,United States,2021,12576,Health Care,Biotechnology: Pharmaceutical Preparations
RNDB,Randolph Bancorp Inc. Common Stock,$24.40,0.00,0.00%,124446734.00,United States,2016,1668,Finance,Major Banks
RNER,Mount Rainier Acquisition Corp. Common Stock,$9.89,0.00,0.00%,219149543.00,United States,2022,2,,
RNERU,Mount Rainier Acquisition Corp. Unit,$10.12,-0.03,-0.296%,0.00,United States,2021,22000,,
RNERW,Mount Rainier Acquisition Corp. Warrant,$0.23,-0.0101,-4.207%,0.00,United States,2022,95100,,
RNLX,Renalytix plc American Depositary Shares,$13.10,-0.97,-6.894%,473623492.00,United Kingdom,2020,81722,Health Care,Medical Specialities
RNST,Renasant Corporation Common Stock,$37.405,-0.035,-0.093%,2085231759.00,United States,,97843,Finance,Major Banks
RNW,ReNew Energy Global plc Class A Ordinary Shares,$5.1797,-0.4703,-8.324%,2075663735.00,United Kingdom,,836838,,
RNWK,RealNetworks Inc. Common Stock,$0.76,-0.0251,-3.197%,35819093.00,United States,1997,201359,Technology,EDP Services
RNWWW,ReNew Energy Global plc Warrant,$0.851,-0.259,-23.333%,0.00,United Kingdom,,886105,,
RNXT,RenovoRx Inc. Common Stock,$3.1517,-0.4483,-12.453%,28075816.00,United States,2021,81932,Health Care,Biotechnology: Pharmaceutical Preparations
ROAD,Construction Partners Inc. Class A Common Stock,$23.45,0.49,2.134%,1229652715.00,United States,2018,224488,Capital Goods,Engineering & Construction
ROC,ROC Energy Acquisition Corp. Common Stock,$9.83,-0.01,-0.102%,213075080.00,United States,2021,900,,
ROCAR,ROC Energy Acquisition Corp. Rights,$0.253,0.001,0.397%,0.00,United States,2021,1200,,
ROCAU,ROC Energy Acquisition Corp. Unit,$10.00,-0.07,-0.695%,0.00,United States,2021,102,,
ROCC,Ranger Oil Corporation Class A Common Stock,$27.72,-0.96,-3.347%,584566373.00,United States,,142134,Energy,Oil & Gas Production
ROCG,Roth CH Acquisition IV Co. Common Stock,$9.83,0.00,0.00%,145842795.00,United States,2021,10,,
ROCGU,Roth CH Acquisition IV Co. Unit,$10.355,0.00,0.00%,0.00,United States,2021,105,,
ROCGW,Roth CH Acquisition IV Co. Warrant,$0.6001,-0.0999,-14.271%,0.00,United States,2021,24766,,
ROCK,Gibraltar Industries Inc. Common Stock,$56.17,-0.29,-0.514%,1835653125.00,United States,1993,42796,,
ROCLU,Roth CH Acquisition V Co. Unit,$9.97,-0.01,-0.10%,0.00,United States,2021,5149,,
ROCLW,Roth CH Acquisition V Co. Warrant,$0.51,0.00,0.00%,0.00,United States,2022,3501,,
ROCR,Roth CH Acquisition III Co. Common stock,$9.89,-0.03,-0.302%,146203870.00,United States,2021,198046,,
ROCRU,Roth CH Acquisition III Co. Unit,$10.06,0.00,0.00%,0.00,United States,2021,9334,,
ROCRW,Roth CH Acquisition III Co. Warrant,$0.75,0.0173,2.361%,0.00,United States,2021,2333,,
ROIC,Retail Opportunity Investments Corp. Common Stock (MD),$17.46,-0.75,-4.119%,2120056335.00,United States,,481162,Consumer Services,Real Estate Investment Trusts
ROIV,Roivant Sciences Ltd. Common Shares,$7.06,-0.19,-2.621%,4885606012.00,United Kingdom,,211443,,
ROIVW,Roivant Sciences Ltd. Warrant,$1.40,-0.15,-9.677%,0.00,United Kingdom,,31246,,
ROKU,Roku Inc. Class A Common Stock,$144.33,-7.80,-5.127%,19392577006.00,United States,2017,4988926,Consumer Services,Television Services
ROLL,RBC Bearings Incorporated Common Stock,$185.115,-5.285,-2.776%,5344314663.00,United States,2005,68600,Capital Goods,Metal Fabrications
ROLLP,RBC Bearings Incorporated 5.00% Series A Mandatory Convertible Preferred Stock,$98.13,-1.86,-1.86%,0.00,United States,,1067,Capital Goods,Metal Fabrications
ROOT,Root Inc. Class A Common Stock,$1.748,-0.152,-8.00%,441370000.00,United States,2020,3420875,Finance,Property-Casualty Insurers
ROSE,Rose Hill Acquisition Corporation Class A Ordinary Shares,$9.95,-0.01,-0.10%,193092188.00,United States,2021,218,,
ROSEU,Rose Hill Acquisition Corporation Unit,$10.0407,-0.021,-0.209%,0.00,United States,2021,285,,
ROSEW,Rose Hill Acquisition Corporation Warrant,$0.33,-0.01,-2.941%,0.00,United States,2021,1550,,
ROST,Ross Stores Inc. Common Stock,$94.75,-0.68,-0.713%,33477992391.00,United States,1985,1626714,Consumer Services,Clothing/Shoe/Accessory Stores
ROVR,Rover Group Inc. Class A Common Stock,$5.91,0.03,0.51%,1036924955.00,United States,2021,221542,Miscellaneous,Other Consumer Services
RPAY,Repay Holdings Corporation Class A Common Stock,$15.36,-0.30,-1.916%,1390687672.00,United States,2018,448769,Technology,EDP Services
RPD,Rapid7 Inc. Common Stock,$90.17,-1.74,-1.893%,5154716380.00,United States,2015,245635,Technology,Computer Software: Prepackaged Software
RPHM,Reneo Pharmaceuticals Inc. Common Stock,$7.7105,0.0105,0.136%,188320481.00,United States,2021,18613,Health Care,Biotechnology: Pharmaceutical Preparations
RPID,Rapid Micro Biosystems Inc. Class A Common Stock,$6.75,-0.19,-2.738%,279129530.00,United States,2021,38646,Health Care,Medical Specialities
RPRX,Royalty Pharma plc Class A Ordinary Shares ,$38.13,-1.01,-2.58%,16377254964.00,United States,2020,951638,Health Care,Biotechnology: Pharmaceutical Preparations
RPTX,Repare Therapeutics Inc. Common Shares,$13.515,0.185,1.388%,564049295.00,Canada,2020,203350,,
RRBI,Red River Bancshares Inc. Common Stock,$52.72,0.00,0.00%,383611808.00,United States,2019,333,Finance,Commercial Banks
RRGB,Red Robin Gourmet Burgers Inc. Common Stock,$13.75,-0.12,-0.865%,216097489.00,United States,2002,229946,Consumer Services,Restaurants
RRR,Red Rock Resorts Inc. Class A Common Stock,$42.53,-0.90,-2.072%,2612473511.00,United States,2016,403260,Consumer Services,Recreational Products/Toys
RSLS,ReShape Lifesciences Inc. Common Stock,$1.18,-0.17,-12.593%,20985152.00,United States,2016,189843,Health Care,Biotechnology: Electromedical & Electrotherapeutic Apparatus
RSSS,Research Solutions Inc Common Stock,$2.113,-0.087,-3.955%,56510323.00,United States,,11604,Technology,Computer Software: Prepackaged Software
RSVR,Reservoir Media Inc. Common Stock,$6.30,-0.58,-8.43%,403636294.00,United States,2021,38057,Consumer Services,Movies/Entertainment
RSVRW,Reservoir Media Inc. Warrant,$1.09,0.0698,6.842%,0.00,United States,2021,103,Consumer Services,Movies/Entertainment
RTLR,Rattler Midstream LP Common Units,$11.63,-0.48,-3.964%,464104082.00,United States,2019,314679,Energy,Oilfield Services/Equipment
RUBY,Rubius Therapeutics Inc. Common Stock,$7.35,0.05,0.685%,660513461.00,United States,2018,411372,Health Care,Biotechnology: Biological Products (No Diagnostic Substances)
RUN,Sunrun Inc. Common Stock,$24.45,-1.46,-5.635%,5061269976.00,United States,2015,6510347,Capital Goods,Building Products
RUSHA,Rush Enterprises Inc. Common Stock Cl A,$54.49,0.63,1.17%,3024877542.00,United States,,156075,Consumer Services,Other Specialty Stores
RUSHB,Rush Enterprises Inc. Class B,$51.41,0.52,1.022%,2853898962.00,United States,,11317,Consumer Services,Other Specialty Stores
RUTH,Ruth's Hospitality Group Inc. Common Stock,$18.235,-0.065,-0.355%,625763529.00,United States,2005,218226,Consumer Services,Restaurants
RVACU,Riverview Acquisition Corp. Unit,$10.4096,0.3796,3.785%,0.00,United States,2021,300,,
RVACW,Riverview Acquisition Corp. Warrant,$0.4664,-0.0006,-0.128%,0.00,United States,2021,3600,,
RVLP,RVL Pharmaceuticals plc Ordinary Shares,$1.1012,-0.0988,-8.233%,91718762.00,United States,2018,319752,Health Care,Biotechnology: Pharmaceutical Preparations
RVMD,Revolution Medicines Inc. Common Stock,$20.96,-1.75,-7.706%,1544481909.00,United States,2020,326203,Consumer Durables,Specialty Chemicals
RVNC,Revance Therapeutics Inc. Common Stock,$12.71,-0.72,-5.361%,912512569.00,United States,2014,488307,Health Care,Biotechnology: Pharmaceutical Preparations
RVPH,Reviva Pharmaceuticals Holdings Inc. Common Stock ,$1.87,0.14,8.092%,9601614.00,United States,2020,3173205,Health Care,Biotechnology: Pharmaceutical Preparations
RVPHW,Reviva Pharmaceuticals Holdings Inc. Warrants,$0.295,-0.005,-1.667%,0.00,United States,2018,9292,Health Care,Biotechnology: Pharmaceutical Preparations
RVSB,Riverview Bancorp Inc Common Stock,$7.68,-0.02,-0.26%,170224950.00,United States,,26485,Finance,Major Banks
RWAY,Runway Growth Finance Corp. Common Stock,$12.58,-0.27,-2.101%,520568124.00,United States,2021,91041,,
RWLK,ReWalk Robotics Ltd. Ordinary Shares,$1.02,-0.06,-5.556%,63704976.00,Israel,2014,1137498,Health Care,Industrial Specialties
RXDX,Prometheus Biosciences Inc. Common Stock,$32.115,-0.425,-1.306%,1250533050.00,United States,2021,181261,Health Care,Biotechnology: Pharmaceutical Preparations
RXRA,RXR Acquisition Corp. Class A Common Stock,$9.71,0.00,0.00%,418743750.00,United States,2021,17,,
RXRAU,RXR Acquisition Corp. Units,$9.85,0.03,0.305%,0.00,United States,2021,200,,
RXRAW,RXR Acquisition Corp. Warrants to purchase Class A common stock,$0.57,-0.03,-5.00%,0.00,United States,2021,9442,,
RXRX,Recursion Pharmaceuticals Inc. Class A Common Stock,$10.87,-0.38,-3.378%,1836954704.00,United States,2021,530808,Health Care,Biotechnology: Pharmaceutical Preparations
RXST,RxSight Inc. Common Stock,$10.195,-0.835,-7.57%,278873163.00,United States,2021,50912,Health Care,Biotechnology: Electromedical & Electrotherapeutic Apparatus
RXT,Rackspace Technology Inc. Common Stock,$12.07,-0.93,-7.154%,2535087109.00,United States,2020,963407,Technology,EDP Services
RYAAY,Ryanair Holdings plc American Depositary Shares,$109.91,-3.53,-3.112%,24907815741.00,Ireland,1997,217561,Transportation,Air Freight/Delivery Services
RYTM,Rhythm Pharmaceuticals Inc. Common Stock,$7.13,-0.17,-2.329%,358413065.00,United States,2017,136296,Health Care,Biotechnology: Pharmaceutical Preparations
RZLT,Rezolute Inc. Common Stock (NV),$4.00,-0.42,-9.502%,61761000.00,United States,,15231,Health Care,Biotechnology: Pharmaceutical Preparations
SABR,Sabre Corporation Common Stock,$8.06,-0.55,-6.388%,2606903969.00,United States,2014,4680778,Technology,EDP Services
SABRP,Sabre Corporation 6.50% Series A Mandatory Convertible Preferred Stock,$109.27,-6.77,-5.834%,0.00,United States,,824,Technology,EDP Services
SABS,SAB Biotherapeutics Inc. Common Stock,$5.295,-0.185,-3.376%,230198955.00,United States,2021,89602,Health Care,Biotechnology: Pharmaceutical Preparations
SABSW,SAB Biotherapeutics Inc. Warrant,$0.91,-0.17,-15.741%,0.00,United States,2021,217629,Health Care,Biotechnology: Pharmaceutical Preparations
